{
  "contract_version": "1.0.0",
  "user_id": "550e8400-e29b-41d4-a716-446655440001",
  "purpose": "research_evidence_resolve",
  "references": [
    {
      "knowledge_base_id": "550e8400-e29b-41d4-a716-446655440010",
      "document_id": "550e8400-e29b-41d4-a716-446655440020",
      "document_version_id": "550e8400-e29b-41d4-a716-446655440031",
      "segment_id": "550e8400-e29b-41d4-a716-446655440041"
    },
    {
      "knowledge_base_id": "550e8400-e29b-41d4-a716-446655440010",
      "document_id": "550e8400-e29b-41d4-a716-446655440020",
      "document_version_id": "550e8400-e29b-41d4-a716-446655440031",
      "segment_id": "550e8400-e29b-41d4-a716-446655440042"
    }
  ]
}
